path,title,tags,description,mime

client/dist/index.html,Animated Preview App,preview-app,A javascript/html client for previewing legends,text/html; charset=utf-8

art/common/normal-leaf.webp,Normal Map,normal leaf,A noise based normal map for a gold foil like texture,image/webp

art/common/icon.webp,Favicon,favicon,A favicon,image/webp
art/common/logo.webp,Favicon,favicon,A favicon,image/webp
art/common/blank.png,Blank,blank,Blank mystery card,image/png

art/common/back-fate.webp,Fate Card Back,back fate,An alpha map for the Fate card back,image/webp
art/common/back-saxon.webp,Saxon Card Back,back saxon,An alpha map for the Saxon card back,image/webp
art/common/back-saxon-bordered.webp,Bordered Saxon Card Back,back saxon-bordered bordered-saxon,An alpha map for the Bordered Saxon card back,image/webp
art/common/back-saxon-worn.webp,Worn Saxon Card Back,back worn-saxon saxon-worn,An alpha map for the Worn Saxon card back,image/webp
art/common/back-compass.webp,Compass Card Back,back compass,An alpha map for the Compass card back,image/webp
art/common/back-cup-extra.webp,Cup Extra Card Back,back cup-extra,An alpha map for the Cup card back,image/webp
art/common/back-cup-inverted.webp,Cup Inverted Card Back,back cup-inverted,An alpha map for the Cup card back,image/webp
art/common/back-cup-wider.webp,Cup Wider Card Back,back cup-wider,An alpha map for the Cup card back,image/webp
art/common/back-cups.webp,Cups Card Back,back cups,An alpha map for the Cups card back,image/webp
art/common/back-helmet.webp,Helmet Card Back,back helmet,An alpha map for the Helmet card back,image/webp
art/common/back-knotwork-moon.webp,Knotwork Moon Card Back,back knotwork-moon,An alpha map for the Knotwork card back,image/webp
art/common/back-knotwork-ravens.webp,Knotwork Ravens Card Back,back knotwork-ravens,An alpha map for the Knotwork card back,image/webp
art/common/back-oath-rings-inverted.webp,Oath Rings Inverted Card Back,back oath-rings-inverted,An alpha map for the Oath card back,image/webp
art/common/back-oath-rings.webp,Oath Rings Card Back,back oath-rings,An alpha map for the Oath card back,image/webp
art/common/back-odal-rune.webp,Odal Rune Card Back,back odal-rune,An alpha map for the Odal card back,image/webp
art/common/back-raven-outline.webp,Raven Outline Card Back,back raven-outline,An alpha map for the Raven card back,image/webp
art/common/back-raven-solid.webp,Raven Solid Card Back,back raven-solid,An alpha map for the Raven card back,image/webp
art/common/back-swords.webp,Swords Card Back,back swords,An alpha map for the Swords card back,image/webp
art/common/back-wyrd.webp,Wyrd Card Back,back wyrd,An alpha map for the Wyrd card back,image/webp
art/common/back-cinematic.webp,Cinematic Card Back,back cinematic,An alpha map for the Cinematic card back,image/webp

art/common/border-greek.webp,Greek Card Border,border greek,An alpha map for the Greek card border,image/webp
art/common/border-naked.webp,Naked Card Border,border bare naked,An alpha map for the Nake card border,image/webp
art/common/border-round.webp,Round Card Border,border round,An alpha map for the Round card border,image/webp
art/common/border-saxon-worn.webp,Worn Saxon Card Border,border worn-saxon saxon-worn,An alpha map for the Worn Saxon card border,image/webp
art/common/border-saxon.webp,Saxon Card Border,border saxon,An alpha map for the Saxon card border,image/webp
art/common/border-staggered.webp,Staggered Card Border,border staggered,An alpha map for the Staggered card border,image/webp
art/common/border-thicc.webp,Thicc Card Border,border thicc,An alpha map for the Thicc card border,image/webp
art/common/border-line.webp,line Card Border,border thin line,An alpha map for the line card border,image/webp
art/common/border-birka-inverted.webp,Birka-inverted Card Border,border birka-inverted,An alpha map for the Birka card border,image/webp
art/common/border-birka.webp,Birka Card Border,border birka,An alpha map for the Birka card border,image/webp
art/common/border-haus-1.webp,Haus 1 Card Border,border haus-1,An alpha map for the Haus card border,image/webp
art/common/border-haus-2.webp,Haus 2 Card Border,border haus-2,An alpha map for the Haus card border,image/webp
art/common/border-haus-3.webp,Haus 3 Card Border,border haus-3,An alpha map for the Haus card border,image/webp
art/common/border-haus-4.webp,Haus 4 Card Border,border haus-4,An alpha map for the Haus card border,image/webp
art/common/border-midgard-serpent.webp,Midgard Serpent Card Border,border midgard-serpent,An alpha map for the Midgard card border,image/webp
art/common/border-moon.webp,Moon Card Border,border moon,An alpha map for the Moon card border,image/webp
art/common/border-odal.webp,Odal Card Border,border odal,An alpha map for the Odal card border,image/webp
art/common/border-solar-cross.webp,Solar Cross Card Border,border solar-cross,An alpha map for the Solar card border,image/webp
art/common/border-sun.webp,Sun Card Border,border sun,An alpha map for the Sun card border,image/webp
art/common/border-valknut.webp,Valknut Card Border,border valknut,An alpha map for the Valknut card border,image/webp
art/common/border-wyrd.webp,Wyrd Card Border,border wyrd,An alpha map for the Wyrd card border,image/webp
art/common/border-cinematic.webp,Cinematic Card Border,border cinematic,An alpha map for the Cinematic card border,image/webp

art/common/mask-line.webp,Line Mask,mask line,An alpha map for a mask,image/webp
art/common/mask-cinematic.webp,cinematic Mask,mask cinematic,An alpha map for a mask,image/webp
art/common/mask-greek.webp,greek Mask,mask greek,An alpha map for a mask,image/webp
art/common/mask-round.webp,round Mask,mask round,An alpha map for a mask,image/webp
art/common/mask-birka.webp,birka Mask,mask birka,An alpha map for a mask,image/webp
art/common/mask-haus.webp,haus Mask,mask haus,An alpha map for a mask,image/webp

art/5-the-hierophant/hierophant-layer-a.webp,A layer,layer,A layer in the magician parallax,image/webp
art/5-the-hierophant/hierophant-layer-b.webp,A layer,layer,A layer in the magician parallax,image/webp
art/5-the-hierophant/hierophant-layer-c.webp,A layer,layer,A layer in the magician parallax,image/webp
art/5-the-hierophant/hierophant-layer-d.webp,A layer,layer,A layer in the magician parallax,image/webp

art/5-the-hierophant/hierophant-flat.webp,Flat,preview flat,A flat version of the card face,image/webp

preview-animated-fate-line-hierophant-hierophant-line.webm,Animated Preview,preview animated back-fate border-line ink-hierophant stock-hierophant line,An animated preview,video/webm
preview-animated-fate-line-hierophant-brilliant-hierophant-gloss-line.webm,Animated Preview,preview animated back-fate border-line ink-hierophant-brilliant stock-hierophant-gloss line,An animated preview,video/webm
preview-animated-oath-rings-inverted-haus-2-hierophant-brilliant-hierophant-gloss-none.webm,Animated Preview,preview animated back-oath-rings-inverted border-haus-2 ink-hierophant-brilliant stock-hierophant-gloss none,An animated preview,video/webm
preview-animated-cups-thicc-hierophant-bright-hierophant-gloss-none.webm,Animated Preview,preview animated back-cups border-thicc ink-hierophant-bright stock-hierophant-gloss none,An animated preview,video/webm
preview-animated-compass-solar-cross-hierophant-bright-hierophant-none.webm,Animated Preview,preview animated back-compass border-solar-cross ink-hierophant-bright stock-hierophant none,An animated preview,video/webm
preview-animated-swords-moon-hierophant-hierophant-none.webm,Animated Preview,preview animated back-swords border-moon ink-hierophant stock-hierophant none,An animated preview,video/webm
preview-animated-raven-solid-greek-hierophant-hierophant-none.webm,Animated Preview,preview animated back-raven-solid border-greek ink-hierophant stock-hierophant none,An animated preview,video/webm
preview-animated-saxon-bordered-birka-hierophant-hierophant-birka.webm,Animated Preview,preview animated back-saxon-bordered border-birka ink-hierophant stock-hierophant birka,An animated preview,video/webm
preview-animated-oath-rings-inverted-haus-3-hierophant-hierophant-haus.webm,Animated Preview,preview animated back-oath-rings-inverted border-haus-3 ink-hierophant stock-hierophant haus,An animated preview,video/webm
preview-animated-cup-wider-birka-inverted-santo-black-none.webm,Animated Preview,preview animated back-cup-wider border-birka-inverted ink-santo stock-black none,An animated preview,video/webm
preview-animated-oath-rings-staggered-energetic-black-line.webm,Animated Preview,preview animated back-oath-rings border-staggered ink-energetic stock-black line,An animated preview,video/webm
preview-animated-saxon-saxon-santo-white-none.webm,Animated Preview,preview animated back-saxon border-saxon ink-santo stock-white none,An animated preview,video/webm
preview-animated-raven-outline-staggered-energetic-hierophant-none.webm,Animated Preview,preview animated back-raven-outline border-staggered ink-energetic stock-hierophant none,An animated preview,video/webm
preview-animated-raven-outline-greek-sanguine-brilliant-black-greek.webm,Animated Preview,preview animated back-raven-outline border-greek ink-sanguine-brilliant stock-black greek,An animated preview,video/webm
preview-animated-fate-sun-hierophant-brilliant-black-none.webm,Animated Preview,preview animated back-fate border-sun ink-hierophant-brilliant stock-black none,An animated preview,video/webm
preview-animated-worn-saxon-bare-hierophant-bright-hierophant-none.webm,Animated Preview,preview animated back-worn-saxon border-bare ink-hierophant-bright stock-hierophant none,An animated preview,video/webm
preview-animated-saxon-bordered-round-lavender-white-round.webm,Animated Preview,preview animated back-saxon-bordered border-round ink-lavender stock-white round,An animated preview,video/webm
preview-animated-worn-saxon-solar-cross-energetic-brilliant-hierophant-none.webm,Animated Preview,preview animated back-worn-saxon border-solar-cross ink-energetic-brilliant stock-hierophant none,An animated preview,video/webm
preview-animated-swords-midgard-serpent-santo-black-none.webm,Animated Preview,preview animated back-swords border-midgard-serpent ink-santo stock-black none,An animated preview,video/webm
preview-animated-helmet-odal-garnet-black-none.webm,Animated Preview,preview animated back-helmet border-odal ink-garnet stock-black none,An animated preview,video/webm
preview-animated-fate-birka-inverted-lavender-bright-black-none.webm,Animated Preview,preview animated back-fate border-birka-inverted ink-lavender-bright stock-black none,An animated preview,video/webm
preview-animated-raven-solid-saxon-silver-hierophant-none.webm,Animated Preview,preview animated back-raven-solid border-saxon ink-silver stock-hierophant none,An animated preview,video/webm
preview-animated-wyrd-naked-energetic-brilliant-hierophant-none.webm,Animated Preview,preview animated back-wyrd border-naked ink-energetic-brilliant stock-hierophant none,An animated preview,video/webm
preview-animated-wyrd-saxon-energetic-black-none.webm,Animated Preview,preview animated back-wyrd border-saxon ink-energetic stock-black none,An animated preview,video/webm
preview-animated-cups-saxon-worn-sanguine-black-none.webm,Animated Preview,preview animated back-cups border-saxon-worn ink-sanguine stock-black none,An animated preview,video/webm
preview-animated-compass-greek-copper-black-greek.webm,Animated Preview,preview animated back-compass border-greek ink-copper stock-black greek,An animated preview,video/webm
preview-animated-saxon-bordered-bare-lavender-black-none.webm,Animated Preview,preview animated back-saxon-bordered border-bare ink-lavender stock-black none,An animated preview,video/webm
preview-animated-cup-wider-haus-1-sanguine-black-none.webm,Animated Preview,preview animated back-cup-wider border-haus-1 ink-sanguine stock-black none,An animated preview,video/webm
preview-animated-saxon-saxon-dusk-black-none.webm,Animated Preview,preview animated back-saxon border-saxon ink-dusk stock-black none,An animated preview,video/webm
preview-animated-compass-haus-4-ferrous-black-none.webm,Animated Preview,preview animated back-compass border-haus-4 ink-ferrous stock-black none,An animated preview,video/webm
preview-animated-compass-birka-silver-white-birka.webm,Animated Preview,preview animated back-compass border-birka ink-silver stock-white birka,An animated preview,video/webm
preview-animated-odal-rune-odal-dusk-black-none.webm,Animated Preview,preview animated back-odal-rune border-odal ink-dusk stock-black none,An animated preview,video/webm
preview-animated-odal-rune-midgard-serpent-energetic-white-none.webm,Animated Preview,preview animated back-odal-rune border-midgard-serpent ink-energetic stock-white none,An animated preview,video/webm
preview-animated-saxon-worn-saxon-dusk-hierophant-none.webm,Animated Preview,preview animated back-saxon border-worn-saxon ink-dusk stock-hierophant none,An animated preview,video/webm
preview-animated-cup-inverted-valknut-energetic-black-none.webm,Animated Preview,preview animated back-cup-inverted border-valknut ink-energetic stock-black none,An animated preview,video/webm
preview-animated-saxon-bordered-line-ferrous-black-none.webm,Animated Preview,preview animated back-saxon-bordered border-line ink-ferrous stock-black none,An animated preview,video/webm
preview-animated-saxon-bordered-sun-lavender-bright-black-none.webm,Animated Preview,preview animated back-saxon-bordered border-sun ink-lavender-bright stock-black none,An animated preview,video/webm
preview-animated-cup-inverted-birka-inverted-santo-black-none.webm,Animated Preview,preview animated back-cup-inverted border-birka-inverted ink-santo stock-black none,An animated preview,video/webm
preview-animated-oath-rings-inverted-bare-dusk-black-none.webm,Animated Preview,preview animated back-oath-rings-inverted border-bare ink-dusk stock-black none,An animated preview,video/webm
preview-animated-helmet-greek-dawn-black-none.webm,Animated Preview,preview animated back-helmet border-greek ink-dawn stock-black none,An animated preview,video/webm
preview-animated-knotwork-ravens-saxon-dawn-black-none.webm,Animated Preview,preview animated back-knotwork-ravens border-saxon ink-dawn stock-black none,An animated preview,video/webm
preview-animated-knotwork-moon-haus-1-octarine-black-none.webm,Animated Preview,preview animated back-knotwork-moon border-haus-1 ink-octarine stock-black none,An animated preview,video/webm
preview-animated-cinematic-sun-ferrous-black-none.webm,Animated Preview,preview animated back-cinematic border-sun ink-ferrous stock-black none,An animated preview,video/webm
preview-animated-knotwork-moon-haus-2-gold-black-none.webm,Animated Preview,preview animated back-knotwork-moon border-haus-2 ink-gold stock-black none,An animated preview,video/webm
preview-animated-oath-rings-greek-energetic-black-none.webm,Animated Preview,preview animated back-oath-rings border-greek ink-energetic stock-black none,An animated preview,video/webm
preview-animated-compass-odal-copper-black-none.webm,Animated Preview,preview animated back-compass border-odal ink-copper stock-black none,An animated preview,video/webm
preview-animated-cinematic-saxon-ferrous-black-none.webm,Animated Preview,preview animated back-cinematic border-saxon ink-ferrous stock-black none,An animated preview,video/webm
preview-animated-raven-solid-greek-energetic-white-greek.webm,Animated Preview,preview animated back-raven-solid border-greek ink-energetic stock-white greek,An animated preview,video/webm
preview-animated-cup-wider-moon-octarine-black-none.webm,Animated Preview,preview animated back-cup-wider border-moon ink-octarine stock-black none,An animated preview,video/webm
preview-animated-knotwork-moon-haus-4-santo-black-none.webm,Animated Preview,preview animated back-knotwork-moon border-haus-4 ink-santo stock-black none,An animated preview,video/webm
preview-animated-saxon-birka-inverted-dawn-black-none.webm,Animated Preview,preview animated back-saxon border-birka-inverted ink-dawn stock-black none,An animated preview,video/webm
preview-animated-cups-greek-octarine-black-none.webm,Animated Preview,preview animated back-cups border-greek ink-octarine stock-black none,An animated preview,video/webm
preview-animated-oath-rings-haus-3-sanguine-bright-black-none.webm,Animated Preview,preview animated back-oath-rings border-haus-3 ink-sanguine-bright stock-black none,An animated preview,video/webm
preview-animated-worn-saxon-line-copper-black-none.webm,Animated Preview,preview animated back-worn-saxon border-line ink-copper stock-black none,An animated preview,video/webm
preview-animated-raven-outline-haus-1-copper-white-none.webm,Animated Preview,preview animated back-raven-outline border-haus-1 ink-copper stock-white none,An animated preview,video/webm
preview-animated-knotwork-ravens-greek-lavender-black-none.webm,Animated Preview,preview animated back-knotwork-ravens border-greek ink-lavender stock-black none,An animated preview,video/webm
preview-animated-knotwork-ravens-saxon-energetic-hierophant-none.webm,Animated Preview,preview animated back-knotwork-ravens border-saxon ink-energetic stock-hierophant none,An animated preview,video/webm
preview-animated-fate-haus-3-octarine-black-none.webm,Animated Preview,preview animated back-fate border-haus-3 ink-octarine stock-black none,An animated preview,video/webm
preview-animated-cup-wider-greek-lavender-bright-white-none.webm,Animated Preview,preview animated back-cup-wider border-greek ink-lavender-bright stock-white none,An animated preview,video/webm
preview-animated-oath-rings-inverted-staggered-energetic-black-none.webm,Animated Preview,preview animated back-oath-rings-inverted border-staggered ink-energetic stock-black none,An animated preview,video/webm
preview-animated-cup-wider-haus-2-sanguine-bright-black-none.webm,Animated Preview,preview animated back-cup-wider border-haus-2 ink-sanguine-bright stock-black none,An animated preview,video/webm
preview-animated-knotwork-moon-moon-silver-black-none.webm,Animated Preview,preview animated back-knotwork-moon border-moon ink-silver stock-black none,An animated preview,video/webm
preview-animated-saxon-solar-cross-copper-black-none.webm,Animated Preview,preview animated back-saxon border-solar-cross ink-copper stock-black none,An animated preview,video/webm
preview-animated-compass-haus-4-octarine-black-none.webm,Animated Preview,preview animated back-compass border-haus-4 ink-octarine stock-black none,An animated preview,video/webm
preview-animated-wyrd-wyrd-ferrous-brilliant-black-none.webm,Animated Preview,preview animated back-wyrd border-wyrd ink-ferrous-brilliant stock-black none,An animated preview,video/webm
preview-animated-cup-extra-sun-energetic-black-none.webm,Animated Preview,preview animated back-cup-extra border-sun ink-energetic stock-black none,An animated preview,video/webm
preview-animated-oath-rings-inverted-midgard-serpent-energetic-black-none.webm,Animated Preview,preview animated back-oath-rings-inverted border-midgard-serpent ink-energetic stock-black none,An animated preview,video/webm
preview-animated-cups-odal-witching-hour-black-none.webm,Animated Preview,preview animated back-cups border-odal ink-witching-hour stock-black none,An animated preview,video/webm
preview-animated-oath-rings-inverted-bare-ferrous-white-line.webm,Animated Preview,preview animated back-oath-rings-inverted border-bare ink-ferrous stock-white line,An animated preview,video/webm
preview-animated-helmet-greek-sanguine-black-greek.webm,Animated Preview,preview animated back-helmet border-greek ink-sanguine stock-black greek,An animated preview,video/webm
preview-animated-cup-extra-birka-inverted-copper-black-none.webm,Animated Preview,preview animated back-cup-extra border-birka-inverted ink-copper stock-black none,An animated preview,video/webm
preview-animated-saxon-haus-2-ferrous-black-haus.webm,Animated Preview,preview animated back-saxon border-haus-2 ink-ferrous stock-black haus,An animated preview,video/webm
preview-animated-knotwork-ravens-midgard-serpent-octarine-black-none.webm,Animated Preview,preview animated back-knotwork-ravens border-midgard-serpent ink-octarine stock-black none,An animated preview,video/webm
preview-animated-saxon-saxon-sanguine-brilliant-black-none.webm,Animated Preview,preview animated back-saxon border-saxon ink-sanguine-brilliant stock-black none,An animated preview,video/webm
preview-animated-oath-rings-haus-1-santo-brilliant-black-none.webm,Animated Preview,preview animated back-oath-rings border-haus-1 ink-santo-brilliant stock-black none,An animated preview,video/webm
preview-animated-worn-saxon-staggered-octarine-black-none.webm,Animated Preview,preview animated back-worn-saxon border-staggered ink-octarine stock-black none,An animated preview,video/webm
preview-animated-cinematic-solar-cross-ferrous-brilliant-black-none.webm,Animated Preview,preview animated back-cinematic border-solar-cross ink-ferrous-brilliant stock-black none,An animated preview,video/webm
preview-animated-knotwork-ravens-solar-cross-sanguine-black-none.webm,Animated Preview,preview animated back-knotwork-ravens border-solar-cross ink-sanguine stock-black none,An animated preview,video/webm
preview-animated-cups-haus-2-copper-white-none.webm,Animated Preview,preview animated back-cups border-haus-2 ink-copper stock-white none,An animated preview,video/webm
preview-animated-wyrd-midgard-serpent-sanguine-bright-black-none.webm,Animated Preview,preview animated back-wyrd border-midgard-serpent ink-sanguine-bright stock-black none,An animated preview,video/webm
preview-animated-fate-greek-sanguine-bright-black-none.webm,Animated Preview,preview animated back-fate border-greek ink-sanguine-bright stock-black none,An animated preview,video/webm
preview-animated-saxon-worn-saxon-garnet-black-none.webm,Animated Preview,preview animated back-saxon border-worn-saxon ink-garnet stock-black none,An animated preview,video/webm
preview-animated-cinematic-saxon-ferrous-hierophant-none.webm,Animated Preview,preview animated back-cinematic border-saxon ink-ferrous stock-hierophant none,An animated preview,video/webm
preview-animated-worn-saxon-thin-dawn-black-none.webm,Animated Preview,preview animated back-worn-saxon border-thin ink-dawn stock-black none,An animated preview,video/webm
preview-animated-worn-saxon-solar-cross-lavender-white-none.webm,Animated Preview,preview animated back-worn-saxon border-solar-cross ink-lavender stock-white none,An animated preview,video/webm
preview-animated-knotwork-ravens-saxon-ferrous-black-none.webm,Animated Preview,preview animated back-knotwork-ravens border-saxon ink-ferrous stock-black none,An animated preview,video/webm
preview-animated-oath-rings-solar-cross-energetic-hierophant-none.webm,Animated Preview,preview animated back-oath-rings border-solar-cross ink-energetic stock-hierophant none,An animated preview,video/webm
preview-animated-fate-haus-4-sanguine-white-none.webm,Animated Preview,preview animated back-fate border-haus-4 ink-sanguine stock-white none,An animated preview,video/webm
preview-animated-compass-haus-3-lavender-black-none.webm,Animated Preview,preview animated back-compass border-haus-3 ink-lavender stock-black none,An animated preview,video/webm
preview-animated-worn-saxon-birka-santo-black-none.webm,Animated Preview,preview animated back-worn-saxon border-birka ink-santo stock-black none,An animated preview,video/webm
preview-animated-oath-rings-round-garnet-black-round.webm,Animated Preview,preview animated back-oath-rings border-round ink-garnet stock-black round,An animated preview,video/webm
preview-animated-raven-solid-haus-3-copper-black-haus.webm,Animated Preview,preview animated back-raven-solid border-haus-3 ink-copper stock-black haus,An animated preview,video/webm
preview-animated-odal-rune-greek-copper-black-greek.webm,Animated Preview,preview animated back-odal-rune border-greek ink-copper stock-black greek,An animated preview,video/webm
preview-animated-saxon-worn-saxon-octarine-black-none.webm,Animated Preview,preview animated back-saxon border-worn-saxon ink-octarine stock-black none,An animated preview,video/webm
preview-animated-compass-moon-ferrous-black-none.webm,Animated Preview,preview animated back-compass border-moon ink-ferrous stock-black none,An animated preview,video/webm
preview-animated-oath-rings-inverted-haus-4-witching-hour-white-none.webm,Animated Preview,preview animated back-oath-rings-inverted border-haus-4 ink-witching-hour stock-white none,An animated preview,video/webm
preview-animated-oath-rings-bare-copper-black-none.webm,Animated Preview,preview animated back-oath-rings border-bare ink-copper stock-black none,An animated preview,video/webm
preview-animated-fate-midgard-serpent-crystal-black-none.webm,Animated Preview,preview animated back-fate border-midgard-serpent ink-crystal stock-black none,An animated preview,video/webm
preview-animated-odal-rune-haus-3-copper-black-none.webm,Animated Preview,preview animated back-odal-rune border-haus-3 ink-copper stock-black none,An animated preview,video/webm
preview-animated-knotwork-ravens-valknut-ferrous-black-none.webm,Animated Preview,preview animated back-knotwork-ravens border-valknut ink-ferrous stock-black none,An animated preview,video/webm
preview-animated-fate-line-sanguine-black-none.webm,Animated Preview,preview animated back-fate border-line ink-sanguine stock-black none,An animated preview,video/webm
preview-animated-compass-birka-inverted-octarine-black-none.webm,Animated Preview,preview animated back-compass border-birka-inverted ink-octarine stock-black none,An animated preview,video/webm
preview-animated-cup-inverted-moon-fools-gold-black-none.webm,Animated Preview,preview animated back-cup-inverted border-moon ink-fools-gold stock-black none,An animated preview,video/webm
